id,faculty_id,type,title,year,nameofpublisher
196,43,Presented/Published,Unsupervised Distance-Based Outlier Detection Using Nearest Neighbours Algorithm on Distributed Approach: Survey,2014,IJIRCCE
197,43,Presented/Published,Overview of Improving Robustness of MAODV Protocol by Combining Tree and Mesh Structures,2015,IOSR-JCE
198,43,Presented/Published,A Survey on Balancing the Network Load Using Geographic Hash Tables,2015,IOSR-JCE
199,43,Presented/Published,SECURING HEALTH CARE DATA IN COLLABORATIVE DATA PUBLISHING USING MAPREDUCE FRAMEWORK,2015,IJRET
200,43,Presented/Published,DATA MINING FOR MALICIOUS CODE DETECTION SYSTEM,2015,MJRET
201,43,Presented/Published,Outlier Detection using Semi-supervised and Unsupervised Learning on High Dimensional Data,2015,IJCA
202,43,Presented/Published,A Survey: A Flexible Approach to Instant-Fuzzy Search Using Effective Phrase Indexing and Segmentation with Proximity Rankin,2015,IJERGS
203,43,Presented/Published,Providing The Security Against The DDOS Attack In Mobile Ad Hoc Networks,2015,IOSR-JCE
204,43,Presented/Published,Improving Robustness of MAODV Protocol by Combining Tree and Mesh Structures,2015,IJCA
205,43,Presented/Published,An Instant-Fuzzy Search Using Phrase Indexing and Segmentation with Proximity Ranking,2015,IJERGS
206,43,Presented/Published,The Detail Survey of Anomaly/Outlier Detection Methods in Data Mining,2015,IJMCR
207,43,Presented/Published,DATA MINING FOR MALICIOUS CODE DETECTION AND SECURITY SYSTEM APPLICATION,2015,IJERGS
208,43,Presented/Published,Survey on Accident Detection using smartphone sensors and rescue System\n,2019,IJARIIE
209,44,Presented/Published,Ids Using Contigeous And Discontigeous System Call Pattern,2014,ICST
210,44,Presented/Published,IoT Based Self Organizing Approach of Multiple Robots(Swarm Robotics),2019,"International Engineering Research Journal (IERJ),"
211,45,Presented/Published,International Refereed Journal of Engineering and Science,"(November 2014),",International Refereed Journal of Engineering and Science
212,45,Presented/Published,SECURE ENERGY EFFICIENT ROUTING IN WIRELESS SENSOR NETWORK,<blank>,Int.J.Computer Technology & Applications1392-1397
213,45,Presented/Published,International Journal on Recent and Innovation Trends in Computing and Communication,<blank>,International Journal on Recent and Innovation Trends in Computing and Communication
214,45,Presented/Published,Survey of Software Fault Localization for Web Application,<blank>,"International Journal of Current Engineering and Technology E-ISSN 2277 – 4106, P-ISSN 2347 – 5161"
215,45,Presented/Published,Efficient Subspace Analysisfor Anomaly Detection,July 2015,"International Journal of Science, Engineering and Technology Research (IJSETR),"
216,45,Presented/Published,International Journal of Applied Engineering Research ? Research India Publications.,2017,International Journal of Applied Engineering Research ? Research India Publications.
217,45,Presented/Published,International Journal of Science and Research,<blank>,(IJSR)
218,45,Presented/Published,International Journal of Advanced Research in Computer Science and Software Engineering,May 2014,<blank>
219,45,Presented/Published,"International Journal of Computer Applications (0975 – 8887) ,",February 2015,<blank>
220,46,Presented/Published,Detection of Unknown Attack and Real Time Clustering for Intrusion Alert Aggregation,Nov. 2014,IJSR
221,46,Presented/Published,A Review on: Implementing Secure Encryption Algorithm for Online Transaction System,2015,IERJ
222,46,Presented/Published,A Survey on Detection Deduplication Encrypted in Cloud,2015,IERJ
223,46,Presented/Published,A System Denial of Service Attack Detection Based on Multivariate Correlation Analysis and Artificial Neural Network,2017,IJIRCCE
224,46,Presented/Published,Resource-Saving File Management Scheme for Online Video Provisioning on Content Delivery Networks,2017,IJRAJ
225,46,Presented/Published,Implementation of Detecting Duplicate File on Cloud Storage Environment,2017,IERJ
226,46,Presented/Published,Implementation Secure Online Payment using Stegano Images,2018,IERJ
227,47,Presented/Published,Personalized Web Directory : A Knowledge Discovery Approach,2013,IJERT
228,48,Presented/Published,Implementation of Multi-Level Trust in Privacy Preserving Data Mining against Non-Linear Attack,April 2015,IJCA
229,48,Presented/Published,Implementation of Multi-Level Trust in Privacy Preserving Data Mining against Non-Linear Attack,Auguest 2014,IJRITCC
230,48,Presented/Published,A Survey Paper on Improved Method for Privacy Preserving Data Mining Considering Linear & Non-Linear Attack,July 2014,IJETCR
231,48,Presented/Published,Automatic Document Clustering Using Machine Learning Approach,2019,"International Journal of Innovative Research in Science, Engineering and Technology"
232,49,Presented/Published,A review paper on Diabete Detection using Genetic Programing,2014,IJCARSMS
233,49,Presented/Published,Diabete Detection using Genetic Programing,2015,IJCA
238,51,Presented/Published,Efficient Clustering of Text Documents for Feature Selection on the use of side Information,2015,IJCSE
239,51,Presented/Published,A Review: Comparison of Text Documents for feature selection on the use of side information\n  with data miningtechniques,2015,IJETCR
240,51,Presented/Published,Network Traffic Optimization For Performance Improvement In\n  The Web Service Infrastructures By Categorization Of The Web Contents With Size Reduction Approach,2014,IJARIET
241,51,Presented/Published,Smart Cloudbased Sharable Health Care System,2019,Journal of Analysis and Computation (JAC)
242,52,Presented/Published,FindingAliases Using Noun Detection Algorithm,2015,IJCA
243,52,Presented/Published,Survey Paper On Natural Language Processing,2014,IJCEA
244,52,Presented/Published,Network Traffic Optimization For Performance Improvement In The Web Service Infrastructures By Categorization Of The Web Contents WithSize Reduction Approach,2014,IJARET
245,52,Presented/Published,Secure And Practical Outsourcing of Linear Programming In Cloud Computing,2013,IJAMTES
246,52,Presented/Published,Survey on Similirity Based Retrival of Trademarks & Logos by Data Similirity,<blank>,International Journal of science and engineering
247,53,Presented/Published,Review Paper on Clustering Based Collaborative Filtering,2014,IJARCSMS
248,53,Presented/Published,Recommending Services using Description Similarity Based Clustering and Collaborative Filtering,2015,IJCA
249,54,Presented/Published,Survey on Scheduling algorithm in Mapreduce framework,2015,IJSETR
250,54,Presented/Published,Good Governance by using Blockchain,<blank>,"International Journal of Research in Engineering, Science and Management"
251,55,Presented/Published,Availability for Efficient audit services in cloud computing.,2013,ICIEA
252,55,Presented/Published,Smart Trolley with Automatic Bill Generation using RFID,2019,IERJ
253,55,Presented/Published,Farmer Advisory System For Crop Cultivation Using Speech Recignition Technology,2019,Journal of Analysis and Computation (JAC)
254,56,Presented/Published,Distributed Database: A Survey,2013,IJCSA
255,56,Presented/Published,Needle less human blood glucose monitoring,<blank>,"International Journal of Research in Engineering, Science and Management"
256,57,Presented/Published,A System to clarify unwanted messages from OSN user surface.,2015,IJSER
257,57,Presented/Published,Clarification of Undesired messages from OSN User surface.,2015,IJCA
258,57,Presented/Published,Survey Paper on My Decision My Privacy,2019,International Journal of Science and Research Technical Education (IJSRTE) – 2018
259,58,Presented/Published,“A Survey on Event Detection and Transmission Protocols in Wireless Sensor Network”,2014,IJARECE
260,58,Presented/Published,"RE3TP: Reliable and Energy Efficient Event Trans-mission Protocol in Event Driven WSN”,",2018,IEEE XPLORE
261,58,Presented/Published,"Detection and Prevention of SQL Injection AttacksUsing Machine Learning Approach”,",2015,IEEE XPLORE
263,60,<blank>,NIL,<blank>,<blank>
264,61,Presented/Published,fuzzy keyword search over encrypted data on cloud computing,2012,IEEE
265,61,Presented/Published,Crowd Sourcing Of Predictor Behavioural Outcomes,2014,IJRCCE
266,61,Presented/Published,user authentication using grid computing,2015,IJRIRCCE
267,61,Presented/Published,Quadcopter For Supporting Disaster,2019,<blank>
268,62,Presented/Published,A Survey on Basics of Cryptography,2017,IJARCCE
269,62,Presented/Published,A New Approach of Cryptographic Technique Using RSA & ECC,2016,IJARCCE
270,62,Presented/Published,Analysis and Implementation of Combined Approach of RSA and ECC Algorithm for Enhanced Data Security,2015,IJCA
271,62,Presented/Published,Review Paper on Behavior of Node in MANET,2015,IJRITCC
272,62,Presented/Published,A Survey On Short Ad Hoc Network,2014,IJERMT
273,62,Presented/Published,Review Paper on Privacy Protection of Database Access with Partial Shuffle,2013,IJCET
274,62,Presented/Published,Deploying Cryptography in Domain Name System: An Overview,2013,IJAIEM
275,63,Published,Analysis and simulation of composite bridge for electrostatic MEMS switch,<blank>,International Journal of Emerging Technology and Advanced Engineering
276,63,Published,RF MEMS Capacitive Shunt Switch: A study based practical overview,<blank>,International Journal of Applied Engineering Research (IJAER) ISSN 0973-4562 UGC Approved Journal
277,63,Published,Impact of Xilinx ISE Design Suite’s MAP and Generate Programming Optimization Settings on FPGAs Bitstream Size,<blank>,Journal of Electronic Design Technology
278,63,Published,"Configuration Bitstream Mapping with pragrammable resources on Spaten 3A FPGA using XDL, FAR",<blank>,International Journal of Engineering and Technology
279,63,Published,Cascading of Compr\nession Algorithm to Reduce Redu\nndancy in FPGAs Configuration \nBitstream A Novel Technique,<blank>,International Journal of Applied Engineering Research ISSN 0973
280,64,<blank>,NIL,<blank>,<blank>
281,65,Published,Programmable Resources on Spartan-3A,2018,"4562 Volume 13, Number 5 (2018) pp."
282,65,Published,FPGA using XDL and FAR,2018,2872
283,65,Published,"Review of Reconfigurable Antennas for LTE, WiMax and WLAN Applications",2017,-
284,65,Published,Sparse Multilinear Laplacian discriminant analysis for gait recognition,2017,2878
285,65,Published,Compact Asymmetric Coplanar Strip Fed Monopole Antenna For Multiband Applications,2015,"International Journal of Innovative Science, Engineering & Technology"
286,65,Published,Vehicle Platooning,2016,International Engineering Research Journal
287,65,Published,T Shaped Fractal Geomerty Based MicroStrip Patch Antenna,2016,International Engineering Research Journal
288,65,Published,A Wireless Surveillance and Safety System for Mine Workers based on ZigBee,2016,International Engineering Research Journal
289,65,Published,Vehicle Control System Implementation Using CAN protocol,2016,International Engineering Research Journal
290,65,Published,A Semi-Autonomous UGV,2015,International Journal of Advanced Research in Computer Engineering & Technology
291,66,Published,Review of Stress Monitoring and Detection,2019,Journal of Emerging Technologies and Innovative Research(JETIR)
292,66,Published,Review of Video Segmentation Approach,2019,Journal of Emerging Technologies and Innovative Research(JETIR)
293,66,Published,Smart Home Environments Utilizing AI & IoT,2019,Journal of Emerging Technologies and Innovative Research(JETIR)
294,66,Published,Study of neural network in video processing,2019,Journal of Emerging Technologies and Innovative Research(JETIR)
295,66,Published,Survey of various road detection and extraction techniques for autonomous vehicles,2019,ACCET 2019
296,66,Published,Detection and classification of plant leaf diseases using image processing techniques: a review,2014,International Journal of Recent Advances in Engineering & Technology
297,66,Published,A Survey on Various Approaches of Image Steganography,2015,International Journal of Computer Applications
298,66,Published,Shot boundary detection using radon projection method,2013,International Journal on Signal and Image Processing
299,66,Published,CBIR using Textural Feature,2012,International Journal of Computer Applications
300,66,Published,Cotton leaf disease detection by feature extraction,2016,Research Advances in the Integration of Big Data and Smart Computing
301,66,Published,Video shot boundary detection using finite ridgelet transform method,2014,ICT and Critical Infrastructure: Proceedings of the 48th Annual Convention of Computer Society of India-Vol II
302,66,Published,Shot Boundary Detection for a Video under the Influence of Illumination: A Adaptive Thresholding Approach,2012,International Journal of Computer Applications
303,66,Published,Face Recognition Using Principal Component Analysis for Security Based System,2015,International Journal of Science and Research (IJSR)
304,66,Published,CONTENT BASED IMAGE RETRIEVAL REVIEW,2014,International Journal of Innovations & Advancement in Computer Science
305,66,Published,CBIR using Histogram & Directional Gabor filtering: A comparative Approach,2012,International journal of computer & Electronics Engineering(IJCEE)
306,66,Published,Shot Boundary Detection for a video under the influence of illumination: An adaptive Thresholding approach,2012,International journal of computer & Electronics Engineering (IJCEE)
307,66,Published,CONTENT BASED IMAGE RETRIEVAL USING EMPIRICAL MODE DECOMPOSITION,2015,"International Journal of Scientific Engineering and Applied Science (IJSEAS) - Volume-1, Issue-4, July 2015"
308,66,Published,Classification Techniques for Computer Vision Based Fruit Quality Inspection: A Review,2014,"International Journal of Recent Advances in Engineering & Technology, Pgno"
309,67,<blank>,NIL,<blank>,<blank>
310,68,<blank>,Detection and notification of potholes and humpsand automation of vehciles by using Rasperry Pi,2018,International Journal of Sciences and Applied Research
311,68,Published,Rash driving alert system,2018,International Journal of Science Engineering and Development Research
312,68,Published,Review Of Geometric Distortions In Digital Image Watermarking,2018,International Journal of Scientific and Engineering Research
313,68,Published,Blind Watermarking Scheme Based On RDWT-DCT For Color Images,2018,International Journal of Technical Research and Applications
314,68,Published,Robust Blind RDWT-DCT Based color Image Watermarking Scheme,2014,International Journal of Multidiciplinary Educational Research
315,68,Published,Digital Iamge watermarking using complex wavelet transform,2014,International Journal of Computer Applications
316,68,Published,An Improved Image Watermarking based on LPM and AQIM,2016,International Journal of Computer Applications
317,68,<blank>,Intelligent Accidental Control of Car System Using CAN Protocol,<blank>,International Journal of Emerging & Technology & Advanced Engineering
318,68,<blank>,GMM based Speaker Verification using MFCC,2015,International Journal of Engineering & Technology
319,68,<blank>,Nueral network based image recognition,2015,"Electronic Circuits & Communication Systems Thapar Institute of Engineering, PATIALA"
320,68,<blank>,Noise Removal from Medical Images using MATLAB,2015,“Recent Advances in Electronics & Communication Technology” at G.N.E Ludhiana
321,68,<blank>,Image Segmentation using MATLAB.,2006,"Electronic Circuits & Communication Systems Thapar Institute of Engineering, PATIALA"
322,68,<blank>,Linear Barcode reading by using Spoatial Domain Spatial Matching Technique,2016,"International Journal ofEngineering ,Science & Computing"
323,68,<blank>,Angle Quantisation Index Modulation Based Robust Image Watermarking,2014,International Journal of Electrical Electronics & Computer Systems
324,68,<blank>,Medical Image Authentication using DWT,<blank>,International Journal of Science and Research
325,68,<blank>,Analysis of MFCC and Multitaper MFCC Feature Extraction Methods,2015,International Journal of Computer Applications
326,68,<blank>,Detection and notification of potholes and humpsand automation of vehciles by using Rasperry Pi,2018,International Journal of Sciences and Applied Research
327,68,<blank>,Rash driving alert system,2018,International Journal of Science Engineering and Development Research
328,69,Published,Wavelet Based Denoising of MRI Images using Thresholding Techniques,2016-17,IJIRSET
329,69,Published,A Survey on Night Vision Techniques and Their Applications,2016-17,IJIRCCE
330,69,Published,"Finger Knuckle Based Biometric Identifier Using Principal Component Analysis, Feature Extraction and K-NN Classifier",2016-17,IJAERS
331,70,Published,Investigation of Fingerprint compression,2018,International Journal of Advance Engineering and Research Development
332,70,Published,A Frequency Reconfigurable Monopole Antenna Using for portable devices,2017,International Journal of Advance Research and Innovative Ideas in Education
333,70,Published,Review of Reconfigurable Monopole Microstrip Patch Antenna Design for Wireless Applications for Handheld & Portable Devices,2017,International Journal for Scientific Research & Development
334,70,Published,Horn Antenna with T-shaped Dual Ridges,2017,International Research Journal of Engineering and Technology 
335,70,Published,A Compact Tri-Band Monopoleantenna For Handheld Devices,2017,International Journal of Advance Research and Innovative Ideas in Education
336,70,Published,ACS Feed Compact Multiband Antenna For Mobile Communication Applications,2017,International Journal of Research in Advent Technology
337,70,Published,"Review of Reconfigurable Antennas for LTE, WiMAX and WLAN Application",2017,ADVANCED ELECTROMAGNETICS
338,70,Published,EDGE PRESERVING ENERGY MINIMIZATION OF FACIAL SKIN SMOOTHENING,2017,International Research Journal of Engineering and Technology 
339,70,Published,Facial Skin Smoothening by Iterative Steering Kernel Regression Technique,2017,"”, International Journal of Innovative Research in Electrical, Electronics, Instrumentation and Control Engineering "
340,70,Published,DRLBP and DRLTP Based Object Recognition for Image Retrieval Systems,2016,International Journal of Advanced Research in Computer and Communication Engineering 
341,70,Published,Review of Retinal Blood Vessel Segmentation Techniques,2015,International Journal of Engineering and Technical Research
342,70,Published,Automated Detection of Skin Cancer and Skin Allergy,2016,International Journal of Advance Research in Computer Science and Management Studies
343,70,Published,Encrypted Data Concealment in Encrypted Images,2016,International Journal Of Innovative Research In Technology
344,70,Published,Entropy Thresholding based Retinal Blood Vessel Segmentation,2016,International Journal of Science and Research
345,70,Published,An Efficient Information Hiding Scheme with High Compression Rate,2016,International Journal of Science Technology & Engineering 
346,70,Published,Image Restoration Technique to Solve Image Deblurring Problem,2016,International Journal of Advanced Research in Computer and Communication Engineering
347,71,Published,Machine Learning Based Method for Alzheimer’s Disease Detection,<blank>,International Journal of Engineering Technology Science and Research IJETSR.
348,71,Published,A Novel Framework for Biometric Authentication Using Segmentation of Iris Detection,<blank>,International Journal For Research & Development in Technology
349,71,Published,Biometric Authentication Using Segmentation of Iris Detection,<blank>,International Journal of Computer Science and Information Technology
350,71,Published,A Review on Steganography using Medical Signal,<blank>,International Journal of Advanced Research in Computer Science and Software Engineering
351,71,Published,Sharing of Patients Private Data using ECG Steganography,<blank>,International Journal of Computer Engineering and Application
352,71,Published,Support Vector Machine Heartbeat Classification,<blank>,IRF (IRAJ Research Forum) International Conference
353,71,Published,SVM classification an Approach on Detecting Abnormality in Brain MRI Images,<blank>,"IJSETR, Vol•4, Issue 5"
354,71,Published,Automatic weld defect detection of steel products using supervised classifier and image segmentation,<blank>,"review paper IJAFRC, vol.2,issue 2, February 2015."
355,71,Published,Content Based Image Retrieval for ROI',<blank>,"International Recognition Research journal, Golden Research Thoughts."
356,71,Published,Introduction to Probabilistic Neural Network,<blank>,International Journal of Advanced Research in Computer Science and Software Engineering
357,71,Published,Morphological and Dynamic Feature based Heartbeat Classification,<blank>,international Journal of Engineering Research and GeneralScience (IJERGS)
358,71,Published,Role and Responsibility of Engineering Faculty in Research Activities,<blank>,38th ISTE National Annual Convention and IEFEES international Conference
359,71,Published,Content based Image retrieval,<blank>,"International Conference on Wireless Networks and Image Processing, Chitkara Institute of Engineering and Technology, Punjab,"
360,71,Published,Content based Image retrieval,<blank>,"‘PES-2009’ National Conference held at PES Institute of Technology, Banglore"
361,71,Published,Content Based Image Retrieval and Resizing of Image Using Discrete Cosine Transform,<blank>,"National Conference on Mobile and Pervasive Computing, Nitte, Karkala"
362,71,Published,Support Vector Machine Heartbeat Classification,<blank>,e-PGCON 2014
363,71,Published,Content based Image retrieval using wavelet transform,<blank>,‘PGCON-2009’Pune
364,71,Presented,Review of Stress Monitoring and Detection,<blank>,National Conference on Advances in Mechanical Engineering and Industrial Management (NCAMEIM 2019)
365,72,Published,Simulation of Rectangular Microstrip Patch Antenna,2015,"International Journal of Innovative Research in Science, Engineering and Technology"
366,72,Published,Design of ‘V’ Shape Microstrip Patch Antenna,2015,International Journal of Innovative Research in Computer and Communication Engineering
367,72,Published,Design of U-shape microstrip patch antenna at 2.4GHz,2015,International Journal of Advanced Research in Computer Engineering & Technology
368,72,Published,WIRELESS OSCILLOSCOPE USING ZIGBEE MODULE IN MATLAB,2015,International Journal of Advanced Research in Computer Engineering & Technology
369,72,Published,FPGA based Efficient Routing Implementation of programmable Network on chip,2016,International Engineering Research Journal (IERJ)
370,72,Published,Design of Micro strip Patch Antenna for L band,2018,International journal of Engineering & Technique(IJET)
371,72,Published,CPW feed Rectangualr Mico-strip Patch Antenna,2018,Journal of Emerging Technologies and Innovative Research(JETIR)
372,73,<blank>,NIL,<blank>,<blank>
373,74,Published,“DESIGN & CONSTRUCTION OF RFID ASSISTED AUTOMATIC BAGGAGE SORTING SYSTEM”,<blank>,International Journal of Advanced Research in Electronics and Communication Engineering (IJARECE)
374,74,Published,“Video Conferencing without PC”,<blank>,International Journal for Science and Research in Technology
375,74,Published,Pruning of Blind Decoding Results for,<blank>,International Engineering Research Journal (IERJ)
376,74,Published,Long Term Evolution,<blank>,International Engineering Research Journal (IERJ)
377,74,Published,CAR SAVVY using Raspberry-Pi,<blank>,International Journal for Science and Research in Technology
378,74,Published,A Two-stage smart Crawler for efficiently harvesting Deep-Web Interfaces,<blank>,International Engineering Research Journal (IERJ)
379,74,Published,Person Re-Identification Over Camera Grids by\n Multi task Distance Metric Learning,<blank>,(IJARCET International Journal of Advanced Research in Computer Engineering & Technology)
380,74,Published,3D Object Approximation from Multi-View Depth Information,<blank>,International Journal of Advanced Research in Computer Engineering & Technology (IJARCET)
381,74,Published,Image as a watermark In Digital Audio Using Arnold Transform & DWT,<blank>,International Journal of Scientific & Engineering Research
382,74,Presented,“An Overview of Digital Watermarking”,<blank>,"Recent Trends in Information Technology,in Nahre ,Pune"
383,75,<blank>,NIL,<blank>,<blank>
385,77,<blank>,NIL,<blank>,<blank>
386,78,<blank>,NIL,<blank>,<blank>
387,79,Published,SURVEY PAPER ON WAVELET BASED ECG STEGANOGRAPHY,2015,International Journal of Research in Engineering and Technology
388,79,Published,HIDING PATIENT CONFIDENTIAL INFORMNATION IN ECG SIGNAL USING DWT TECHNIQUE,2015,International Journal of Advanced Research in Computer Engineering & Technology
389,79,Published,Wavelet Based Image Reconstruction,2018,International journal of Engineering & Technique(IJET)
390,79,Published,AES Encrypted Wavelet Based ECG Steganography,2018,International journal of Engineering & Technique(IJET)
391,80,<blank>,NIL,<blank>,<blank>
392,81,Published,Innovative Haar-LBP scheme based Human Identification using Finger knuckle pattern,2015,International Journal of Advanced Research in Electronics and Communication Engineering
393,81,Published,Exploring the Finger Dorsal Pattern for human Identification using LBP-Haar Decomposition and 1-D Log Gabor Filter,2016,International Journal of Advanced Research in Computer Engineering & Technology
394,82,Published,Smart Home Environments Utilizing AI & IoT,2019,Journal of Emerging Technologies and Innovative Research(JETIR)
395,82,Presented,Smart Home Environments Utilizing AI & IoT,2019,National Conference on Advances in Mechanical Engineering and Industrial Management (NCAMEIM 2019)
396,83,Published,Wavelet based Image Reconstruction,2018,International journal of Engineering & Technique(IJET)
