id,faculty_id,type,title,year,nameofpublisher
397,83,Published,AES Encrypted Wavelet Based ECG Stegnography,2018,International journal of Engineering & Technique(IJET)
398,83,Published,Railway Track Security System,2018,International Rsearch journal of Engineering & Technology (IRJET)
399,84,Published,Area efficient  FIR filter design using FFA algorithm based on VLSI design,2015,International Journal Multidisciplinary educational research
400,85,Presented/Published,Review of Video Segmentation Approach,2019,Advancement in Mechanical Engineering and Industrial Management (NCAMEIM2019)
401,86,<blank>,NIL,<blank>,<blank>
402,88,Presented & Published,IT in Rural Development,2006,ISTE (Maharashtra&Goa) &\nMGMs C.O.E. Nanded
403,88,Presented & Published,Routing in WDM optical\nNetworking,2006,"ADELCO Kovilpatti,\nTamilnadu."
404,88,Presented & Published,Open Loop Speed Control of Separately Excited D.C. Shunt Motor Using Analog\nTriggering Circuit (1).,2006,"N.M.A.M.I.T., Nitte,\nKarnataka, National conference."
405,88,Presented & Published,Photolithographic Techniques for LSI and VLSI.,2006,"RTIT-06\nNational Conference at J.T.Mahajan College of Engineering, Faizpur."
406,88,Presented & Published,Review of Power Supplies and Proposed High Frequency SMPS based Inverter with Power Factor\nImprovement Circuit,2006,"RTIT-06\nNational Conference at J.T.Mahajan College of Engineering, Faizpur"
407,88,Presented & Published,High Frequency SMPS Based Inverter with\nImproved Power Factor ISBN: 0-7803-9772-X\nINSPEC Accession Number: 9518050,2006,"PEDES-2006, IEEE\nInternational Conference at IIT Delhi,(Published in Ieee.xplore, International Publication, reference www.ieeexplore.ieee.org)"
408,88,Presented & Published,Overview of Power Factor Correction Approaches,2006,"NCETE-06 National Conference at MAE Alandi\n(D), Pune on"
409,88,Presented & Published,Microcontroller Based High Frequency Inverter,2007,"International Conference on Modeling and Simulation, at\nKolkata, India"
410,88,Presented & Published,Emerging Strategies  for Power Factor Correction,2007,"National Conference ETSPC-07 at MAE, Alandi\n(D), Pune."
411,88,Presented & Published,A Low Cost Active Power Factor Corrector for SMPS/UPS,2008,"National Conference NCPEIC 08 at Malaviya National Institute of\nTechnology, Jaipur"
412,88,Presented & Published,Microcontroller Based High Frequency Inverter with\nPower Factor Corrector,2008,"INNOVATION-2008\nBCUD and Sinhgad COE, Pune. (Poster Presentation)"
413,88,Presented & Published,Concept of Regenerative Power : A Review,2008,"PICETE2008\nInternational Conference at Pravara Rural Societys College of Engineering,\nLoni. (Maharashtra) India"
414,88,Presented & Published,Emerging Strategies for Active Power Factor Correction in SMPS/UPS,2009,"ICIT-09 (IEEE) Melbourne, Australia"
415,88,Presented & Published,Concept of Regenerative Power,2008,"International Conference (ICSC-08) at Alwar Institute\nof Technology, Alwar"
416,88,Presented & Published,Microcontroller Based High Frequency Inverter with\nPower Factor Corrector,2009,"INNOVATION-2009\nBCUD and Sinhgad COE, Pune. (Paper Presentation)"
417,88,Presented & Published,Ticket Management  System,2009,"NCETEV 2009, National Conference at MAE Alandi\n(D), Pune."
418,88,Presented & Published,Alternative Method: Regeneration,2010,"National Conference on Alternative Energy Sources “POWER ON – 2010” at\nSinhgad Academy of Engineering, Kondhwa (BK), Pune -411048"
419,88,Presented & Published,Microcontroller Based Ticket Management System,2010,"National Conference on Emerging Trends in Engineering, Technology and Management at SSBTs COE, Bambhori, Jalgaon."
420,88,Presented & Published,A Prapaid Electronic Card System For Local Transport,2010,"International Journal Of Emerging Technologies And Applications In Engineering, Technology And Sciences"" (IJ-ETA-ETS), ISSN: 0974-\n3588 pp. 220-222"
421,88,Presented & Published,Animation and Simulation in Power Electronics Engineering,2011,"IJMRAE, ISSN 0975-7074,\nVol.3, No. I (January 2011), pp. 129-140."
422,88,Presented & Published,Microcontroller Based Variable Voltage Variable Frequency Square Wave Inverter,2011,"icost 2011, International Conference on Sunries Technologies at SSVPSCOE,Dhule\n(Maharashtra)"
423,88,Presented & Published,Ticket Management System,2010,Applied for National Patent\nProvisional Application No. 3318/MUM/2010
424,88,Presented & Published,Microcontroller Based Variable Voltage Variable Frequency Square Wave Inverter,2011,"IJAEA, International Journal ISSN:0975-7783(Print), 0975-7791(Online)\npp.58-60"
425,88,Presented & Published,A Smart Card Based Intelligent Attendance System,2011,"NCET-2011,\nNational Conference at Govt. Engineering College Goa."
426,88,Presented & Published,Zigbee Based PIC Controlled Ammunitions For Military Surveillance,2011,"NCET-2011,\nNational Conference at Govt. Engineering College Goa."
427,88,Presented & Published,Photolithographic Techniques for LSI and VLSI,2012,International Journal of Scientific and Engineering Research(France)\nISSN - 2229-5518
428,88,Presented & Published,Electronic Toll System,2012,National conference on Electronics Technologies
429,88,Presented & Published,Design and development of High Frequency Multitasking Inverter,2012,International Journal of Scientific and Engineering Research(France)\nISSN - 2229-5518
430,88,Presented & Published,An Effective Solution for Monitoring and Optimizing Energy Utilization for\nSMART GRID,2012,"International Journal of Engineering & Research Technology,\nISSN-2278-0181"
431,88,Presented & Published,Improving Speech Perception of Sensorineural Hearing Impaired Using DSP\nTMS320C6713,2013,International Conference on “Innovative Technology in Engineering & Science”\n2012-13
432,88,Presented & Published,A review of Automotive Networking Protocols-Past Current and Future.,2013,International Conference on “Innovative Technology in Engineering & Science”\n2012-13
433,88,Presented & Published,Automated Voting System Using GSM Mobile Technology.,2013,"International Interdisciplinary Research Conference on Economics, Commerce, Management &\nTechnology"
434,88,Presented & Published,Electricity generation from waste (urine),2014,International Journal of technology & science
435,88,Presented & Published,IP-Telephony Replacement of PSTN PBX system in Small organization.,2015,National Conference On Advanced Networking
436,88,Presented & Published,Four Extended-Reach TDM PONs Sharing a Bidirectional Hybrid CWDM\nAmplifier,2016,International Journal of Current Trends in Engineering & Research\nISSN: 2455-1392
437,88,Presented & Published,Performance analysis of Optical Amplifier in WDM System,2016,International Journal of Current Trends in Engineering & Research\nISSN: 2455-1392
438,88,Presented & Published,Micro strip Antenna with Four Rectangular Slot for Quad Band Application,2016,International Conference on Quality Upgrading in Engineering Science &\nTechnology
439,88,Presented & Published,Performance Analysis of Optical CDMA with Hadamard Code,2016,International Conference on Quality Upgrading in Engineering Science &\nTechnology
440,88,Presented & Published,Improvement of downlink LTE system performances using nonlinear equalization\nmethods based in wiener- Hammerstein,2016,International Journal of Current Trends in Engineering & Research ISSN 2455-1392
441,88,Presented & Published,Performance evaluation of downlink LTE cellular network with a volterra\nbased filter equalizer,2016,International Journal of Current Trends in Engineering & Research\nISSN 2455-1392
442,88,Presented & Published,Multasking Inverter,2017,"4th International Conference on Science, Technology & Management (ICSTM-2017),\nIJEECS, ISSN 2348-117X"
443,89,NIL,NIL,NIL,NIL
444,90,Presented & Published, Bias Dependent Charge Trapping in MOSFET’s during 1 and 6MeV electron irradiation.,2008,Nuclear Instruments and Methods in Physics Research B
445,90,Presented & Published,Damage Induced by High Energy multiply charged Oxygen ions in Oxide coated silicon.,2006,Nuclear Instruments and Methods in Physics Research B
446,90,Presented & Published,Influence of High-Energy Fluorine Ion as a Contamination on n-channel MOS-structure.,2005,Presented in INDO-GERMAN Workshop on “Synthesis and Modification of Nano Structured Materials by Energetic Ion Beams” Poster-99
447,90,Presented & Published, Use of Phototransistor as a Radiation Monitor.,2005,Journal of Medical Physics
448,90,Presented & Published,A Sensitive n-MOSFET Dosimetry for High energy X-radiations.,2005,Journal of Medical Physics
449,90,Presented & Published,In-situ MOSFET Dosimetry for High Energy X-ray and Electrons.,2004,Journal of Medical Physics
450,90,Presented & Published,MeV Energy Fluorine ion induced interface and oxide states in n-MOS structure.,2004,"Presented in 15th International Workshop on Inelastic Ion-Surface Collision (IISC-15)Oct 17-22,  ISE-SHIMA, JAPAN"
451,90,Presented & Published, Behaviour of Channel Mobility In 6MeV Electron Irradiation MOS-StructureUnder Bias Condition at Room Temperature.,2003,Department of Atomic Energy-Solid State Physics Symposium
452,91,Presented & Published," Synthesis And Antimicrobial Activity of Hepta-O-Benzoyl-β-D-Lactosyl-3-(2)-Hydrazino-1, 3-Benzothiazolyl Thiocarbamides",2012,American Journal of PharmTech Research
453,91,Presented & Published,Synthesis and in vitro biological evaluation of 1-hepta-O-benzoyl-β-D-maltosyl-4-benzothiazolyl semicarbazides,2013,RASAYAN Journal of Chemistry
454,91,Presented & Published," Synthesis and antimicrobial activity of 1-naphthyl-2-hydrazino-1, 3-benzothiazolyl carbamides",2014,Journal of Indian Chemical Society
455,91,Presented & Published, Synthesis and antimicrobial activity of n-glucosylated derivatives of thiadiazolidines,2014,Indian Journal of Heterocyclic Chemistry
456,91,Presented & Published,Synthesis and microbial assay of maltosyltetrazinobenzothiazoles,2014,Der Pharmacia Lettre
457,91,Presented & Published,Synthesis and In Vitro Biological Studies of N-Glycosylated Semicarbazides,2015,Der PharmaChemica
458,91,Presented & Published,??Synthesis and screening of sugar triazolidines for antimicrobial activity,2015,Indian Journal of Chemistry
459,91,Presented & Published,Synthesis and antimicrobial activity of 1-Hepta-O-Benzoyl-β-D-Lactosyl-3-(2) BenzothiazolylCarbamides,2015,Indian Journal of Heterocyclic Chemistry
460,91,Presented & Published,"Synthesis and antimicrobial activity of 1-naphthyl-2-hydrazino-1, 3-benzothiazolyl carbamides,ORG (Oral)-30.",2011,48th Annual Convention of Chemists
461,91,Presented & Published,"Synthesis of Hepta-O-Benzoyl-β-D-Lactosyl-3-(2)-Hydrazino-1, 3-Benzothiazolyl Thiocarbamides, Poster-127.",2012,99th Session of Indian Science Congress Association
462,91,Presented & Published,"Synthesis and screening of sugar triazolidines for antimicrobial activity, ORG (Award Paper)-11.",2012,49th Annual Convention of Chemists
463,91,Presented & Published," Synthesis and biological evaluation of Hepta-O-benzoyl-β-D-maltosyl-3-(2)-substituted hydrazino-1, 3-benzothiazolyl carbamides, Poster-113.",2013,100th Session of Indian Science Congress
464,91,Presented & Published,"Synthesis and biological evaluation of N-glucosylatedthiadiazolidinecarbamides, held at Poster-26.",2013,National Conference on Frontier Areas in Chemistry (NCFAC-2013)
465,91,Presented & Published,"Synthesis of novel glycosylthiadiazolotriazines and screening for antimicrobial activity, ORG (Award Paper)-03.",2013,50th Annual Convention of Chemists
466,91,Presented & Published,"Novel GlycosylCarboxamidoOxoquinazolines: A Potent Antimicrobial Agent, PPG-222.",2014,"AVISHKAR, 8th Maharashtra State Inter-University Research Convention"
467,91,Presented & Published,"Synthesis of novel glycosylthiatriazinesas microbial growth inhibitors, Abstract No. Oral-52.",2014,International Conference on Global Opportunities for Latest Development in Chemistry and Technology
468,91,Presented & Published,"Synthesis and antimicrobial studies of maltosyltetrazinobenzothiazoles, Poster- 52.",2014,3rdInternational Conference of Indian Council of Chemists on Chemistry for Sustainable Development: Indian Perspective
469,91,Presented & Published,"Synthesis of Novel GlycosylImidazolidinylBenzenesulphonamide as Potent Antimicrobial Agent, ORG (Oral)-02.",2014,51th Annual Convention of Chemists
470,91,Presented & Published,"Synthesis and Microbial Assessment of Sugar SulphanilamidoCarbamides, Poster-83.",2015,102th Session of Indian Science Congress
471,91,Presented & Published,"One pot synthesis of novel bis (glycosylimidazolidinyl) benzenesulphonamide as potent microbial growth inhibitor, Oral-09.",2015,National Conference on Sustainable Chemistry: Frontiers & Challenges
472,91,Presented & Published,<blank>,<blank>,<blank>
473,91,Presented & Published,"A facile method for the synthesis of novel biorelevantglycosylquinazolinyl imidazolidin-2,4-diones, Oral-04.",2015,International Conference on Futuristic Materials and Emerging Trends in Forensic and Life Sciences
474,91,Presented & Published,<blank>,<blank>,<blank>
475,91,Presented & Published,"One Pot Synthesis of Novel Biorelevant Glycosyl Thioxo Pentaaza Anthracene Pentaone, Oral-16.",2016,National Conference on Chemical Sciences: Emerging Scenario & Challenges
476,91,Presented & Published,<blank>,<blank>,<blank>
477,91,Presented & Published,Synthesis And?Screening of LactosylTetrazinoBenzothiazoles?for Antimicrobial Activity,2018,National Conference on Recent Advances in Chemical Sciences (NCRACS)
478,92,Presented & Published,Two fluid Axially Symmetric Cosmological Models in f(R; T ) Theory of Gravitation,2015, Malaya Journal of  Mathematics
479,92,Presented & Published,Dark Energy Cosmological Model in f(R; T) Theory of Gravity,2015,Prespacetime Journal
480,92,Presented & Published,Role of Constant Deceleration Parameter in Cosmological Model filled with DE in f(R; T ) Theory,2016,Bulgerian Journal of Physics
481,92,Presented & Published,Magnetized Domain Wall in f(R; T) Gravity,2017,New Astronomy
482,92,Presented & Published,Plane Symmetric Cosmological Model with Quark and Strange Quark Matter in f(R; T) Theory of Gravity,2017,Journal of Astrophysics and  Astronomy
483,92,Presented & Published,Vacuum Solutions of FRW and Axially Symmetric Space-time in f(R) Theory of Gravity,?2018,Iranian Journal of Science and Technology Trans Sci
484,92,Presented & Published,"Kaluza-Klein Cosmological Models in f(R,T) Theory of Gravity",2018,New Astronomy
485,92,Presented & Published,Two fluid Axially Symmetric Cosmological Model in f(R) Theory of Gravity,2019,Prespacetime Journal
486,92,Presented & Published,"A modified holographic Ricci Dark Energy model in f(R,T) theory of Gravity",2019,Journal of Astrophysics and Astronomy
487,93,NIL,NIL,NIL,NIL
488,94,Presented,A review paper on student performance using decision tree algorithms,2019,A National Conference on \nAdvancements in Mechanical Engineering and Industrial Management 2019 \n(NCAMEIM 2019) \n
489,95,NIL,NIL,NIL,NIL
490,96,NIL,NIL,NIL,NIL
491,97,NIL,NIL,NIL,NIL
492,98,NIL,NIL,NIL,NIL
493,99,Presented,A review paper on student performance using decision tree algorithms,2019,A National Conference on \nAdvancements in Mechanical Engineering and Industrial Management 2019 \n(NCAMEIM 2019) \n
494,100,NIL,NIL,NIL,NIL
495,101,Published,Fluorescence Studies of Salicylic Acid in Solution and Polymer Film,2008,Asian Journal of Chemistry
496,102,NIL,NIL,NIL,NIL
497,103,NIL,NIL,NIL,NIL
498,104,NIL,NIL,NIL,NIL
499,105,NIL,NIL,NIL,NIL
500,106,NIL,NIL,NIL,NIL
501,107,Published,Machine Learning Based Method for Alzheimer’s Disease Detection,<blank>,International Journal of Engineering Technology Science and Research IJETSR.
502,107,Published,A Novel Framework for Biometric Authentication Using Segmentation of Iris Detection,<blank>,International Journal For Research & Development in Technology
503,107,Published,Biometric Authentication Using Segmentation of Iris Detection,<blank>,International Journal of Computer Science and Information Technology
504,107,Published,A Review on Steganography using Medical Signal,<blank>,International Journal of Advanced Research in Computer Science and Software Engineering
505,107,Published,Sharing of Patients Private Data using ECG Steganography,<blank>,International Journal of Computer Engineering and Application
506,107,Published,Support Vector Machine Heartbeat Classification,<blank>,IRF (IRAJ Research Forum) International Conference
507,107,Published,SVM classification an Approach on Detecting Abnormality in Brain MRI Images,<blank>,"IJSETR, Vol•4, Issue 5"
508,107,Published,Automatic weld defect detection of steel products using supervised classifier and image segmentation,<blank>,"review paper IJAFRC, vol.2,issue 2, February 2015."
509,107,Published,Content Based Image Retrieval for ROI',<blank>,"International Recognition Research journal, Golden Research Thoughts."
510,107,Published,Introduction to Probabilistic Neural Network,<blank>,International Journal of Advanced Research in Computer Science and Software Engineering
511,107,Published,Morphological and Dynamic Feature based Heartbeat Classification,<blank>,international Journal of Engineering Research and GeneralScience (IJERGS)
512,107,Published,Role and Responsibility of Engineering Faculty in Research Activities,<blank>,38th ISTE National Annual Convention and IEFEES international Conference
513,107,Published,Content based Image retrieval,<blank>,"International Conference on Wireless Networks and Image Processing, Chitkara Institute of Engineering and Technology, Punjab,"
514,107,Published,Content based Image retrieval,<blank>,"‘PES-2009’ National Conference held at PES Institute of Technology, Banglore"
515,107,Published,Content Based Image Retrieval and Resizing of Image Using Discrete Cosine Transform,<blank>,"National Conference on Mobile and Pervasive Computing, Nitte, Karkala"
516,107,Published,Support Vector Machine Heartbeat Classification,<blank>,e-PGCON 2014
517,107,Published,Content based Image retrieval using wavelet transform,<blank>,‘PGCON-2009’Pune
518,107,Presented,Review of Stress Monitoring and Detection,<blank>,National Conference on Advances in Mechanical Engineering and Industrial Management (NCAMEIM 2019)
519,108,Published,“DESIGN & CONSTRUCTION OF RFID ASSISTED AUTOMATIC BAGGAGE SORTING SYSTEM”,<blank>,International Journal of Advanced Research in Electronics and Communication Engineering (IJARECE)
520,108,Published,“Video Conferencing without PC”,<blank>,International Journal for Science and Research in Technology
521,108,Published,Pruning of Blind Decoding Results for,<blank>,International Engineering Research Journal (IERJ)
522,108,Published,Long Term Evolution,<blank>,International Engineering Research Journal (IERJ)
523,108,Published,CAR SAVVY using Raspberry-Pi,<blank>,International Journal for Science and Research in Technology
524,108,Published,A Two-stage smart Crawler for efficiently harvesting Deep-Web Interfaces,<blank>,International Engineering Research Journal (IERJ)
525,108,Published,Person Re-Identification Over Camera Grids by\n Multi task Distance Metric Learning,<blank>,(IJARCET International Journal of Advanced Research in Computer Engineering & Technology)
526,108,Published,3D Object Approximation from Multi-View Depth Information,<blank>,International Journal of Advanced Research in Computer Engineering & Technology (IJARCET)
527,108,Published,Image as a watermark In Digital Audio Using Arnold Transform & DWT,<blank>,International Journal of Scientific & Engineering Research
528,108,Presented,“An Overview of Digital Watermarking”,<blank>,"Recent Trends in Information Technology,in Nahre ,Pune"
529,109,NIL,NIL,NIL,NIL
530,110,NIL,NIL,NIL,NIL
531,111,NIL,NIL,NIL,NIL
532,112,NIL,NIL,NIL,NIL
533,113,NIL,NIL,NIL,NIL
534,114,NIL,NIL,NIL,NIL
535,115,NIL,NIL,NIL,NIL
538,118,NIL,NIL,NIL,NIL
539,119,NIL,NIL,NIL,NIL
540,120,NIL,NIL,NIL,NIL
541,121,Published,Review on Privacy Preserving Deep Computation Model on Cloud for Big Data Feature Learning,2016,International Journal of Science &amp; Research (IJSR)
542,121,Presented & Published,“Privacy Preserving Feature Learning on Cloud for Big Data”,2018, 5 th International Conference on Innovations in Computer Science & Engineering (ICICSE 2017) by Springer
543,122,Published,Minimum Spanning Tree Approach for Routing & Scheduling,2004,Recent Advances in Mechanical Engineering
544,122,Published,Implementation of Condition Based Maintenance Using Vibration Monitoring Technique,2009,Journal of Institution of Engineer (India)
545,122,Published,Condition Based System Reliability with Imperfect Preventive Maintenance,2012,"All India Manufacturing Technology, Design and Research"
546,122,Published,Concept Generation Process of Patient Transferring Device,2012,Springer
547,122,Published,Monte-Carlo Simulation of Two Echelon Supply Chain,2013,Indian Institute of Industrial Engineering Journal
548,122,Published,CBM Policy for an Online Continuously Monitored Deteriorating System with Random Change of Mode,2013,Springer
549,122,Published,Clean Room Classification for Pharmaceutical Industry,2015,International Journal of Engineering and Technical Research
550,122,Published,Failure of Screw Jack on Inclined Surface,2015,International Journal of Science Engineering and Technology Research
551,122,Published,Study of Influence of Grease Contaminants in Vibration Response of Ball Bearings,2016,International Journal of Science And Applied Research in Technology
552,122,Published,Analysis of Latent Heat Based High Temperature Solar Energy Storage Unit,2016,International Journal of Current Engineering and Technology
553,122,Published,Application of RCM Methodology & Modeling for Availability of the System,2018,International Journal Management Concepts & Philosophy
554,123,Published,1.Strategies for Buyer Supplier Relationship Improvement: Scale Development and Validation,2018,Procedia Manufacturing  (Elsevier)
555,123,Published,2.Supplier Development Success Factors in Indian Manufacturing Practice,2018, Materials Today (Elsevier)
556,123,Published,3.To Examine the Relationships between Supplier Development Practices and Supplier-Buyer Relationship Practices from the Supplier's Perspective,2018,"Benchmarking: an International Journal, (Emerald)"
557,123,Published,4. Experimental Investigation of Heat Transfer by Natural Convection with Perforated Pin Fin Array,2017,Procedia Manufacturing  (Elsevier)
558,123,Published,5. Optimization of cutting parameter for surface finish and hole accuracy in drilling of EN31: A Taguchi approach,2018,International Journal of Management Concepts and Philosophy (Inderscience)
559,123,Published,6. Strategic buyer supplier relationship improvement: development of constructs and measurement,2017,International Journal of Supply Chain and Inventory Management  (Inderscience)
560,123,Published,7. Critical Success Factors forSupplier Development and Buyer Supplier Relationship: Exploratory Factor Analysis,2016,International Journal of Strategic Decision Sciences  (IGI global)
561,123,Published,8. Structural Equation Modelling of Determinants of Buyer-Supplier Relationship Improvement Strategies: Case of Indian Manufacturing Firms,2016,Asia-Pacific Journal of Management Research and Innovation (SAGE)
562,123,Published,9. Applying Statistical Process Control Techniques: A Case of Coupling Disc Manufacturing Company,2017,Industrial Engineering Journal
563,123,Published,10. A Structural Equation Modeling Approach for Buyer Supplier Relationship Development Strategies,2016,Smart Journal of Business Management
564,123,Published,11. Applications of Wireless Sensors in Agriculture Field for Monitoring of Parameters,2017,"International Journal of Research in Engineering, IT and Social Sciences"
565,123,Published,12. Wireless Sensor Network and Monitoring of Crop Field,2017,IOSR Journal of Electronics and Communication Engineering
566,123,Published,13. Wireless Sensors Application for Controlling Of Crop Field Parameters,2017,International Education and Research Journal
567,123,Published,14. Validation of Constructs for Buyer Supplier Relationship Development Strategies: Indian Manufacturing Context,2016,European Journal of Business and Management
568,123,Published,15. Identification of Factor for Development of Buyer Supplier Relationship,2015,Journal of Research in Business and Management
569,123,Published,16. Supplier Development Practices & Current Trends: A Review of Literature,2013,International Journal of Mechanical Engineering and Technology
570,123,Published,17.Supplier Development: Theories and Practices,2012,IOSR Journal of Mechanical and Civil Engineering
571,123,Presented,18. Supplier Development Success Factors In Indian Manufacturing Practices,2017,"7th International Conference on Materials Proceeding & Characterization (17-19 March 2017) at Gokaraju Rangaraju Institute of Engineering and Technology, Hyderabad, INDIA"
572,123,Presented,19. Wireless Sensor Network and Agriculture Parameter Monitoring and Controlling,2017,"International Conference on Intelligent Computing, Instrumentation and Control Technologies (ICICICT) at Vimal Jyothi Engineering College, Kannur, (Paper ID 718) (IEEE), INDIA"
573,123,Presented,20.Emerging Constructs for Supplier Development and Supplier Relationship Practices: Indian Manufacturing Case,2016,"6th International & 27th All India Manufacturing Technology, Design and Research Conference (AIMTDR-2016),at College of Engineering., Pune,\nMaharashtra, INDIA. "
574,123,Published,21. Strategies for Buyer Supplier Relationship development in Indian Manufacturing Context\n,2019,Journal of Emerging Technologies and Innovative Research
